,title,context,question,answers
224,Digimon,"The first Digimon television series, which began airing on March 7, 1999 in Japan on Fuji TV and Kids Station and on August 14, 1999 in the United States on Fox Kids dubbed by Saban Entertainment for the North American English version. Its premise is a group of 7 kids who, while at summer camp, travel to the Digital World, inhabited by creatures known as Digital Monsters, or Digimon, learning they are chosen to be ""DigiDestined"" (""Chosen Children"" in the Japanese version) to save both the Digital and Real World from evil. Each Kid was given a Digivice which selected them to be transported to the DigiWorld and was destined to be paired up with a Digimon Partner, such as Tai being paired up with Agumon and Matt with Gabumon. The children are helped by a mysterious man/digimon named Gennai, who helps them via hologram. The Digivices help their Digimon allies to Digivolve into stronger creatures in times of peril. The Digimon usually reached higher forms when their human partners are placed in dangerous situations, such as fighting the evil forces of Devimon, Etemon and Myotismon in their Champion forms. Later, each character discovered a crest that each belonged to a person; Tai the Crest of Courage, Matt the Crest of Friendship, Sora the Crest of Love, Izzy the Crest of Knowledge, Mimi the Crest of Sincerity, Joe the Crest of Reliability, T.K. the Crest of Hope, and later Kari the Crest of Light which allowed their Digimon to digivolve into their Ultimate forms. The group consisted of seven original characters: Taichi ""Tai"" Kamiya, Yamato ""Matt"" Ishida, Sora Takenouchi, Koushiro ""Izzy"" Izumi, Mimi Tachikawa, Joe Kido, and Takeru ""T.K."" Takaishi. Later on in the series, an eighth character was introduced: Hikari ""Kari"" Kamiya (who is Taichi's younger sister).",What let the characters reach their final state?,crest
225,Kanye_West,"The College Dropout was eventually issued by Roc-A-Fella in February 2004, shooting to number two on the Billboard 200 as his debut single, ""Through the Wire"" peaked at number fifteen on the Billboard Hot 100 chart for five weeks. ""Slow Jamz"", his second single featuring Twista and Jamie Foxx, became an even bigger success: it became the three musicians' first number one hit. The College Dropout received near-universal critical acclaim from contemporary music critics, was voted the top album of the year by two major music publications, and has consistently been ranked among the great hip-hop works and debut albums by artists. ""Jesus Walks"", the album's fourth single, perhaps exposed West to a wider audience; the song's subject matter concerns faith and Christianity. The song nevertheless reached the top 20 of the Billboard pop charts, despite industry executives' predictions that a song containing such blatant declarations of faith would never make it to radio. The College Dropout would eventually be certified triple platinum in the US, and garnered West 10 Grammy nominations, including Album of the Year, and Best Rap Album (which it received). During this period, West also founded GOOD Music, a record label and management company that would go on to house affiliate artists and producers, such as No I.D. and John Legend. At the time, the focal point of West's production style was the use of sped-up vocal samples from soul records. However, partly because of the acclaim of The College Dropout, such sampling had been much copied by others; with that overuse, and also because West felt he had become too dependent on the technique, he decided to find a new sound.",Why did the 10 grammy nominee feel the need to alter his approach to his future music?,"sampling had been much copied by others; with that overuse, and also because West felt he had become too dependent on the technique, he decided to find a new sound"
226,Supreme_court,"However, not all highest courts are named as such. Civil law states do not tend to have singular highest courts. Additionally, the highest court in some jurisdictions is not named the ""Supreme Court"", for example, the High Court of Australia; this is because decisions by the High Court could formerly be appealed to the Privy Council. On the other hand, in some places the court named the ""Supreme Court"" is not in fact the highest court; examples include the New York Supreme Court, the Supreme Courts of several Canadian provinces/territories and the former Supreme Court of Judicature of England and Wales, which are all superseded by higher Courts of Appeal.",Whose holding would be controlling over the New York Supreme Court?,Courts of Appeal
227,Indigenous_peoples_of_the_Americas,"According to both indigenous American and European accounts and documents, American civilizations at the time of European encounter had achieved many accomplishments. For instance, the Aztecs built one of the largest cities in the world, Tenochtitlan, the ancient site of Mexico City, with an estimated population of 200,000. American civilizations also displayed impressive accomplishments in astronomy and mathematics. The domestication of maize or corn required thousands of years of selective breeding.",What was a key scientific accomplishment by American civilizations?,The domestication of maize or corn
228,"St._John%27s,_Newfoundland_and_Labrador","St. John's has a humid continental climate (Köppen Dfb), with lower seasonal variation than normal for the latitude, which is due to Gulf Stream moderation. However, despite this maritime moderation, average January high temperatures are actually slightly colder in St. John's than it is in Kelowna, British Columbia, which is an inland city that is near the more marine air of the Pacific, demonstrating the cold nature of Eastern Canada. Mean temperatures range from −4.9 °C (23.2 °F) in February to 16.1 °C (61.0 °F) in August, showing somewhat of a seasonal lag in the climate. The city is also one of the areas of the country most prone to tropical cyclone activity, as it is bordered by the Atlantic Ocean to the east, where tropical storms (and sometimes hurricanes) travel from the United States. The city is one of the rainiest in Canada outside of coastal British Columbia. This is partly due to its propensity for tropical storm activity as well as moist, Atlantic air frequently blowing ashore and creating precipitation.",Where is St. John's?,Canada
229,Yale_University,"Slack (2003) compares three groups that conducted biological research at Yale during overlapping periods between 1910 and 1970. Yale proved important as a site for this research. The leaders of these groups were Ross Granville Harrison, Grace E. Pickford, and G. Evelyn Hutchinson, and their members included both graduate students and more experienced scientists. All produced innovative research, including the opening of new subfields in embryology, endocrinology, and ecology, respectively, over a long period of time. Harrison's group is shown to have been a classic research school; Pickford's and Hutchinson's were not. Pickford's group was successful in spite of her lack of departmental or institutional position or power. Hutchinson and his graduate and postgraduate students were extremely productive, but in diverse areas of ecology rather than one focused area of research or the use of one set of research tools. Hutchinson's example shows that new models for research groups are needed, especially for those that include extensive field research.","What do Harrison, Pickford, and Hutchinson have in common?","All produced innovative research, including the opening of new subfields in embryology, endocrinology, and ecology, respectively, over a long period of time"
230,Arena_Football_League,"After its return in 2010, the AFL had its national television deal with the NFL Network for a weekly Friday night game. All AFL games not on the NFL Network could be seen for free online, provided by Ustream.",What returned after 2009?,the AFL
231,Jews,"Throughout history, many rulers, empires and nations have oppressed their Jewish populations or sought to eliminate them entirely. Methods employed ranged from expulsion to outright genocide; within nations, often the threat of these extreme methods was sufficient to silence dissent. The history of antisemitism includes the First Crusade which resulted in the massacre of Jews; the Spanish Inquisition (led by Tomás de Torquemada) and the Portuguese Inquisition, with their persecution and autos-da-fé against the New Christians and Marrano Jews; the Bohdan Chmielnicki Cossack massacres in Ukraine; the Pogroms backed by the Russian Tsars; as well as expulsions from Spain, Portugal, England, France, Germany, and other countries in which the Jews had settled. According to a 2008 study published in the American Journal of Human Genetics, 19.8% of the modern Iberian population has Sephardic Jewish ancestry, indicating that the number of conversos may have been much higher than originally thought.",The Jewish populations were sought to be destroyed by what last thing?,nations
232,Late_Middle_Ages,"The 1469 marriage of Isabella I of Castile and Ferdinand II of Aragon and the 1479 death of John II of Aragon led to the creation of modern-day Spain. In 1492, Granada was captured from the Moors, thereby completing the Reconquista. Portugal had during the 15th century – particularly under Henry the Navigator – gradually explored the coast of Africa, and in 1498, Vasco da Gama found the sea route to India. The Spanish monarchs met the Portuguese challenge by financing the expedition of Christopher Columbus to find a western sea route to India, leading to the discovery of the Americas in 1492.","During the 15th century, what was area was discovered by the Spanish?",the Americas
233,Beer,"After boiling, the hopped wort is now cooled, ready for the yeast. In some breweries, the hopped wort may pass through a hopback, which is a small vat filled with hops, to add aromatic hop flavouring and to act as a filter; but usually the hopped wort is simply cooled for the fermenter, where the yeast is added. During fermentation, the wort becomes beer in a process which requires a week to months depending on the type of yeast and strength of the beer. In addition to producing ethanol, fine particulate matter suspended in the wort settles during fermentation. Once fermentation is complete, the yeast also settles, leaving the beer clear.",What is required to happen  after the H2O changed from a liquid to a vapor?,the hopped wort is now cooled
234,Alloy,"Conversely, most heat-treatable alloys are precipitation hardening alloys, which produce the opposite effects that steel does. When heated to form a solution and then cooled quickly, these alloys become much softer than normal, during the diffusionless transformation, and then harden as they age. The solutes in these alloys will precipitate over time, forming intermetallic phases, which are difficult to discern from the base metal. Unlike steel, in which the solid solution separates to form different crystal phases, precipitation hardening alloys separate to form different phases within the same crystal. These intermetallic alloys appear homogeneous in crystal structure, but tend to behave heterogeneous, becoming hard and somewhat brittle.",What type of alloys get harder as they get older?,precipitation hardening alloys
235,"Raleigh,_North_Carolina","Raleigh is also served by Triangle Transit (known formerly as the Triangle Transit Authority, or TTA). Triangle Transit offers scheduled, fixed-route regional and commuter bus service between Raleigh and the region's other principal cities of Durham, Cary and Chapel Hill, as well as to and from the Raleigh-Durham International Airport, Research Triangle Park and several of the region's larger suburban communities. Triangle Transit also coordinates an extensive vanpool and rideshare program that serves the region's larger employers and commute destinations.",What is the name of a large town in the service area?,Research Triangle Park
236,Order_of_the_British_Empire,"India, while remaining an active member of the Commonwealth, chose as a republic to institute its own set of honours awarded by the President of India who holds a republican position some consider similar to that of the monarch in Britain. These are commonly referred to as the Padma Awards and consist of Padma Vibhushan, Padma Bhushan and Padma Shri in descending order. These do not carry any decoration or insignia that can be worn on the person and may not be used as titles along with individuals' names.",What party is the Indian president?,republican
237,Baptists,"On 20 June 1995, the Southern Baptist Convention voted to adopt a resolution renouncing its racist roots and apologizing for its past defense of slavery. More than 20,000 Southern Baptists registered for the meeting in Atlanta. The resolution declared that messengers, as SBC delegates are called, ""unwaveringly denounce racism, in all its forms, as deplorable sin"" and ""lament and repudiate historic acts of evil such as slavery from which we continue to reap a bitter harvest."" It offered an apology to all African-Americans for ""condoning and/or perpetuating individual and systemic racism in our lifetime"" and repentance for ""racism of which we have been guilty, whether consciously or unconsciously."" Although Southern Baptists have condemned racism in the past, this was the first time the predominantly white convention had dealt specifically with the issue of slavery.",What egregious action happened to Black Americans?,slavery
238,Professional_wrestling,"Although professional wrestling in Mexico (lucha libre) also has stories and characters, they are less emphasized. Wrestlers in Mexico are traditionally more agile and perform more aerial maneuvers than professional wrestlers in the U.S. who, more often, rely on power moves and strikes to subdue their opponents. The difference in styles is due to the independent evolution of the sport in Mexico beginning in the 1930s and the fact that wrestlers in the cruiserweight division (peso semicompleto) are often the most popular wrestlers in Mexican lucha libre. Wrestlers often execute high flying moves characteristic of lucha libre by utilizing the wrestling ring's ropes to catapult themselves towards their opponents, using intricate combinations in rapid-fire succession, and applying complex submission holds. Lucha libre is also known for its tag team wrestling matches, in which the teams are often made up of three members, instead of two as is common in the U.S.",What size of wrestler is more sought after in Mexico?,cruiserweight
239,Republic_of_the_Congo,"Bantu-speaking peoples who founded tribes during the Bantu expansions largely displaced and absorbed the earliest inhabitants of the region, the Pygmy people, about 1500 BC. The Bakongo, a Bantu ethnic group that also occupied parts of present-day Angola, Gabon, and Democratic Republic of the Congo, formed the basis for ethnic affinities and rivalries among those countries. Several Bantu kingdoms—notably those of the Kongo, the Loango, and the Teke—built trade links leading into the Congo River basin.",What were examples of tribes founded during Bantu expansions?,"Kongo, the Loango, and the Teke"
240,Police,"In Terry v. Ohio (1968) the court divided seizure into two parts, the investigatory stop and arrest. The court further held that during an investigatory stop a police officer's search "" [is] confined to what [is] minimally necessary to determine whether [a suspect] is armed, and the intrusion, which [is] made for the sole purpose of protecting himself and others nearby, [is] confined to ascertaining the presence of weapons"" (U.S. Supreme Court). Before Terry, every police encounter constituted an arrest, giving the police officer the full range of search authority. Search authority during a Terry stop (investigatory stop) is limited to weapons only.",Mike DeWine is the current governor of __,Ohio
241,Rule_of_law,"The Rule of Law is especially important as an influence on the economic development in developing and transitional countries. To date, the term “rule of law” has been used primarily in the English-speaking countries, and it is not yet fully clarified even with regard to such well-established democracies as, for instance, Sweden, Denmark, France, Germany, or Japan. A common language between lawyers of common law and civil law countries as well as between legal communities of developed and developing countries is critically important for research of links between the rule of law and real economy.",__ has the freest labour market in Europe.,Denmark
242,Federalism,"Alternatively, or in addition to this practice, the members of an upper house may be indirectly elected by the government or legislature of the component states, as occurred in the United States prior to 1913, or be actual members or delegates of the state governments, as, for example, is the case in the German Bundesrat and in the Council of the European Union. The lower house of a federal legislature is usually directly elected, with apportionment in proportion to population, although states may sometimes still be guaranteed a certain minimum number of seats.",the people of the upper house are representatives of the state where,German Bundesrat and in the Council of the European Union
243,Infection,"Thus, the technological ability to detect any infectious agent rapidly and specifically are currently available. The only remaining blockades to the use of PCR as a standard tool of diagnosis are in its cost and application, neither of which is insurmountable. The diagnosis of a few diseases will not benefit from the development of PCR methods, such as some of the clostridial diseases (tetanus and botulism). These diseases are fundamentally biological poisonings by relatively small numbers of infectious bacteria that produce extremely potent neurotoxins. A significant proliferation of the infectious agent does not occur, this limits the ability of PCR to detect the presence of any bacteria.",Why don't the diagnoses of some diseases benefit from PCR?,A significant proliferation of the infectious agent does not occur
244,John_von_Neumann,"Von Neumann's principal contribution to the atomic bomb was in the concept and design of the explosive lenses needed to compress the plutonium core of the Fat Man weapon that was later dropped on Nagasaki. While von Neumann did not originate the ""implosion"" concept, he was one of its most persistent proponents, encouraging its continued development against the instincts of many of his colleagues, who felt such a design to be unworkable. He also eventually came up with the idea of using more powerful shaped charges and less fissionable material to greatly increase the speed of ""assembly"".",What was the real name for what fell on Nagasaki?,the atomic bomb
245,Premier_League,"The Premier League distributes a portion of its television revenue to clubs that are relegated from the league in the form of ""parachute payments"". Starting with the 2013–14 season, these payments are in excess of £60 million over four seasons. Though designed to help teams adjust to the loss of television revenues (the average Premier League team receives £55 million while the average Football League Championship club receives £2 million), critics maintain that the payments actually widen the gap between teams that have reached the Premier League and those that have not, leading to the common occurrence of teams ""bouncing back"" soon after their relegation. For some clubs who have failed to win immediate promotion back to the Premier League, financial problems, including in some cases administration or even liquidation have followed. Further relegations down the footballing ladder have ensued for several clubs unable to cope with the gap.",Money from what media outlet goes to teams?,television
246,Cork_(city),"Temperatures below 0 °C (32 °F) or above 25 °C (77 °F) are rare. Cork Airport records an average of 1,227.9 millimetres (4.029 ft) of precipitation annually, most of which is rain. The airport records an average of 7 days of hail and 11 days of snow or sleet a year; though it only records lying snow for 2 days of the year. The low altitude of the city, and moderating influences of the harbour, mean that lying snow very rarely occurs in the city itself. There are on average 204 ""rainy"" days a year (over 0.2 millimetres (0.0079 in) of rainfall), of which there are 73 days with ""heavy rain"" (over 5 millimetres (0.20 in)). Cork is also a generally foggy city, with an average of 97 days of fog a year, most common during mornings and during winter. Despite this, however, Cork is also one of Ireland's sunniest cities, with an average of 3.9 hours of sunshine every day and only having 67 days where there is no ""recordable sunshine"", mostly during and around winter.",What is the evidence that weather there is capable of freezing precipitation?,7 days of hail and 11 days of snow or sleet a year
247,Political_party,"The United States has become essentially a two-party system. Since a conservative (such as the Republican Party) and liberal (such as the Democratic Party) party has usually been the status quo within American politics. The first parties were called Federalist and Republican, followed by a brief period of Republican dominance before a split occurred between National Republicans and Democratic Republicans. The former became the Whig Party and the latter became the Democratic Party. The Whigs survived only for two decades before they split over the spread of slavery, those opposed becoming members of the new Republican Party, as did anti-slavery members of the Democratic Party. Third parties (such as the Libertarian Party) often receive little support and are very rarely the victors in elections. Despite this, there have been several examples of third parties siphoning votes from major parties that were expected to win (such as Theodore Roosevelt in the election of 1912 and George Wallace in the election of 1968). As third party movements have learned, the Electoral College's requirement of a nationally distributed majority makes it difficult for third parties to succeed. Thus, such parties rarely win many electoral votes, although their popular support within a state may tip it toward one party or the other. Wallace had weak support outside the South. More generally, parties with a broad base of support across regions or among economic and other interest groups, have a great chance of winning the necessary plurality in the U.S.'s largely single-member district, winner-take-all elections. The tremendous land area and large population of the country are formidable challenges to political parties with a narrow appeal.",__ are more fiscally conservative than Republicans.,Libertarian
248,Immaculate_Conception,"Some Western writers claim that the immaculate conception of Mary is a teaching of Islam. Thus, commenting in 1734 on the passage in the Qur'an, ""I have called her Mary; and I commend her to thy protection, and also her issue, against Satan driven away with stones"", George Sale stated: ""It is not improbable that the pretended immaculate conception of the virgin Mary is intimated in this passage. For according to a tradition of Mohammed, every person that comes into the world, is touched at his birth by the devil, and therefore cries out, Mary and her son only excepted; between whom, and the evil spirit God placed a veil, so that his touch did not reach them. And for this reason they say, neither of them were guilty of any sin, like the rest of the children of Adam.""",Whose pregnancy do some authors believe is Muslim?,Mary
249,Mandolin,"Antonio Vivaldi composed a mandolin concerto (Concerto in C major Op.3 6) and two concertos for two mandolins and orchestra. Wolfgang Amadeus Mozart placed it in his 1787 work Don Giovanni and Beethoven created four variations of it. Antonio Maria Bononcini composed La conquista delle Spagne di Scipione Africano il giovane in 1707 and George Frideric Handel composed Alexander Balus in 1748. Others include Giovani Battista Gervasio (Sonata in D major for Mandolin and Basso Continuo), Giuseppe Giuliano (Sonata in D major for Mandolin and Basso Continuo), Emanuele Barbella (Sonata in D major for Mandolin and Basso Continuo), Domenico Scarlatti (Sonata n.54 (K.89) in D minor for Mandolin and Basso Continuo), and Addiego Guerra (Sonata in G major for Mandolin and Basso Continuo).",Who created a variation of Vivaldi's mandolin concerto?,Don Giovanni and Beethoven
250,Incandescent_light_bulb,"Incandescent bulbs have been replaced in many applications by other types of electric light, such as fluorescent lamps, compact fluorescent lamps (CFL), cold cathode fluorescent lamps (CCFL), high-intensity discharge lamps, and light-emitting diode lamps (LED). Some jurisdictions, such as the European Union, China, Canada and United States, are in the process of phasing out the use of incandescent light bulbs while others, including Colombia, Mexico, Cuba, Argentina, Brazil and Australia, have prohibited them already.",Mention one jurisdiction that is not in the process of phasing out the use of incandescent light bulbs.,Colombia
251,Genome,"Interspersed repeats mainly come from transposable elements (TEs), but they also include some protein coding gene families and pseudogenes. Transposable elements are able to integrate into the genome at another site within the cell. It is believed that TEs are an important driving force on genome evolution of higher eukaryotes. TEs can be classified into two categories, Class 1 (retrotransposons) and Class 2 (DNA transposons).",What are retrotransposons and DNA transposons?,transposable elements
