,title,context,question,answers
107,Queen_(band),"In late 1975, Queen recorded and released A Night at the Opera, taking its name from the popular Marx Brothers movie. At the time, it was the most expensive album ever produced. Like its predecessor, the album features diverse musical styles and experimentation with stereo sound. In ""The Prophet's Song"", an eight-minute epic, the middle section is a canon, with simple phrases layered to create a full-choral sound. The Mercury penned ballad, ""Love of My Life"", featured a harp and overdubbed vocal harmonies. The album was very successful in Britain, and went triple platinum in the United States. The British public voted it the 13th greatest album of all time in a 2004 Channel 4 poll. It has also ranked highly in international polls; in a worldwide Guinness poll, it was voted the 19th greatest of all time, while an ABC poll saw the Australian public vote it the 28th greatest of all time. A Night at the Opera has frequently appeared in ""greatest albums"" lists reflecting the opinions of critics. Among other accolades, it was ranked number 16 in Q Magazine's ""The 50 Best British Albums Ever"" in 2004, and number 11 in Rolling Stone's ""The 100 Greatest Albums of All Time"" as featured in their Mexican edition in 2004. It was also placed at No. 230 on Rolling Stone magazine's list of ""The 500 Greatest Albums of All Time"" in 2003. A Night at the Opera is the third and final Queen album to be featured in the book 1001 Albums You Must Hear Before You Die.","Which poll did A Night at the Opera rank better, the Australian public vote or in a worldwide Guinness poll?",worldwide Guinness poll
108,University_of_Kansas,"The KU School of Engineering is an ABET accredited, public engineering school located on the main campus. The School of Engineering was officially founded in 1891, although engineering degrees were awarded as early as 1873.",What kind of school is this?,School of Engineering
109,Pacific_War,"Two battle-hardened Australian divisions were steaming from the Mid-East for Singapore. Churchill wanted them diverted to Burma, but Curtin insisted on a return to Australia. In early 1942 elements of the Imperial Japanese Navy proposed an invasion of Australia. The Japanese Army opposed the plan and it was rejected in favour of a policy of isolating Australia from the United States via blockade by advancing through the South Pacific. The Japanese decided upon a seaborne invasion of Port Moresby, capital of the Australian Territory of Papua which would put Northern Australia within range of Japanese bomber aircraft.",39% of the population of __ was born elsewhere.,Singapore
110,Arnold_Schwarzenegger,"In October 2013, the New York Post reported that Schwarzenegger was exploring a future run for president. The former California governor would face a constitutional hurdle; Article II, Section I, Clause V nominally prevents individuals who are not natural-born citizens of the United States from assuming the office. He has reportedly been lobbying legislators about a possible constitutional change, or filing a legal challenge to the provision. Columbia University law professor Michael Dorf observed that Schwarzenegger's possible lawsuit could ultimately win him the right to run for the office, noting, ""The law is very clear, but it’s not 100 percent clear that the courts would enforce that law rather than leave it to the political process.""",What is one avenue through which Schwarzenegger might have addressed this hurdle?,the courts
111,Universal_Studios,"""Junior"" Laemmle persuaded his father to bring Universal up to date. He bought and built theaters, converted the studio to sound production, and made several forays into high-quality production. His early efforts included the critically mauled part-talkie version of Edna Ferber's novel Show Boat (1929), the lavish musical Broadway (1929) which included Technicolor sequences; and the first all-color musical feature (for Universal), King of Jazz (1930). The more serious All Quiet on the Western Front (1930), won its year's Best Picture Oscar.",__ was directed by Paul fejos.,Broadway
112,Guam,"The first European to discover Guam was Portuguese navigator Ferdinand Magellan, sailing for the King of Spain, when he sighted the island on March 6, 1521 during his fleet's circumnavigation of the globe.:41–42 When Magellan arrived on Guam, he was greeted by hundreds of small outrigger canoes that appeared to be flying over the water, due to their considerable speed. These outrigger canoes were called Proas, and resulted in Magellan naming Guam Islas de las Velas Latinas (""Islands of the Lateen sails""). Antonio Pigafetta, one of Magellan's original 18 the name ""Island of Sails"", but he also writes that the inhabitants ""entered the ships and stole whatever they could lay their hands on"", including ""the small boat that was fastened to the poop of the flagship."":129 ""Those people are poor, but ingenious and very thievish, on account of which we called those three islands Islas de los Ladrones (""Islands of thieves"")."":131",What are the three islands called?,"""Islands of thieves"""
113,Glass,"Glass has the ability to refract, reflect, and transmit light following geometrical optics, without scattering it. It is used in the manufacture of lenses and windows. Common glass has a refraction index around 1.5. This may be modified by adding low-density materials such as boron, which lowers the index of refraction (see crown glass), or increased (to as much as 1.8) with high-density materials such as (classically) lead oxide (see flint glass and lead glass), or in modern uses, less toxic oxides of zirconium, titanium, or barium. These high-index glasses (inaccurately known as ""crystal"" when used in glass vessels) cause more chromatic dispersion of light, and are prized for their diamond-like optical properties.","__ is a lustrous, greyish-white, soft, ductile, malleable metal that is solid at room temperature, though it is hard and brittle at lesser purities.",zirconium
114,Flowering_plant,"In the dicotyledons, the bundles in the very young stem are arranged in an open ring, separating a central pith from an outer cortex. In each bundle, separating the xylem and phloem, is a layer of meristem or active formative tissue known as cambium. By the formation of a layer of cambium between the bundles (interfascicular cambium), a complete ring is formed, and a regular periodical increase in thickness results from the development of xylem on the inside and phloem on the outside. The soft phloem becomes crushed, but the hard wood persists and forms the bulk of the stem and branches of the woody perennial. Owing to differences in the character of the elements produced at the beginning and end of the season, the wood is marked out in transverse section into concentric rings, one for each season of growth, called annual rings.",What formation is created in each bundle seperating the xylem and phloem,a layer of meristem or active formative tissue
115,Tuberculosis,"One-third of the world's population is thought to be infected with TB. New infections occur in about 1% of the population each year. In 2014, there were 9.6 million cases of active TB which resulted in 1.5 million deaths. More than 95% of deaths occurred in developing countries. The number of new cases each year has decreased since 2000. About 80% of people in many Asian and African countries test positive while 5–10% of people in the United States population tests positive by the tuberculin test. Tuberculosis has been present in humans since ancient times.",Who is really vulnerable to infection by TB?,people in many Asian and African countries
116,Josip_Broz_Tito,"Josip Broz was born on 7 May 1892 in Kumrovec, in the northern Croatian region of Hrvatsko Zagorje in Austria-Hungary.[nb 1] He was the seventh child of Franjo and Marija Broz. His father, Franjo Broz (26 November 1860 – 16 December 1936), was a Croat, while his mother Marija (25 March 1864 – 14 January 1918), was a Slovene. His parents were married on 21 January 1891. After spending part of his childhood years with his maternal grandfather Martin Javeršek in the Slovenian village of Podsreda, he entered primary school in 1900 at Kumrovec, he failed the 2nd grade and graduated in 1905. In 1907 he moved out of the rural environment and started working as a machinist's apprentice in Sisak. There, he became aware of the labour movement and celebrated 1 May – Labour Day for the first time. In 1910, he joined the union of metallurgy workers and at the same time the Social-Democratic Party of Croatia and Slavonia. Between 1911 and 1913, Broz worked for shorter periods in Kamnik (1911–1912, factory ""Titan""), Cenkov, Munich and Mannheim, where he worked for the Benz car factory; then he went to Wiener Neustadt, Austria, and worked as a test driver for Daimler.",In what part of a season did Broz emerge into the world?,May
117,Eton_College,"In July 2015, Eton accidentally sent emails to 400 prospective students, offering them conditional entrance to the school in September 2017. The email was intended for nine students, but an IT glitch caused the email to be sent to 400 additional families, who didn't necessarily have a place. In response, the school issued the following statement: ""This error was discovered within minutes and each family was immediately contacted to notify them that it should be disregarded and to apologise. We take this type of incident very seriously indeed and so a thorough investigation, overseen by the headmaster Tony Little and led by the tutor for admissions, is being carried out to find out exactly what went wrong and ensure it cannot happen again. Eton College offers its sincere apologies to those boys concerned and their families. We deeply regret the confusion and upset this must have caused.""","How many students did Eton think they were emailing when they clicked ""send""?",nine
118,Muslim_world,"Encompasses both secular and religious styles, the design and style made by Muslims and their construction of buildings and structures in Islamic culture included the architectural types: the Mosque, the Tomb, the Palace and the Fort. Perhaps the most important expression of Islamic art is architecture, particularly that of the mosque. Through Islamic architecture, effects of varying cultures within Islamic civilization can be illustrated. Generally, the use of Islamic geometric patterns and foliage based arabesques were striking. There was also the use of decorative calligraphy instead of pictures which were haram (forbidden) in mosque architecture. Note that in secular architecture, human and animal representation was indeed present.",__ is equal parts art and science.,arabesques
119,Adult_contemporary_music,"These Christmas music marathons typically start during the week before Thanksgiving Day and end after Christmas Day, or sometimes extending to New Year's Day. Afterwards, the stations usually resume their normal music fare. Several stations begin the holiday format much earlier, at the beginning of November. The roots of this tradition can be traced back to the beautiful music and easy listening stations of the 1960s and 1970s.",__ is a popular music genre and radio format that was most popular during the 1950s to 1970s,easy listening
120,Xbox_360,"While the original Xbox sold poorly in Japan, selling just 2 million units while it was on the market (between 2002 and 2005),[citation needed] the Xbox 360 sold even more poorly, selling only 1.5 million units from 2005 to 2011. Edge magazine reported in August 2011 that initially lackluster and subsequently falling sales in Japan, where Microsoft had been unable to make serious inroads into the dominance of domestic rivals Sony and Nintendo, had led to retailers scaling down and in some cases discontinuing sales of the Xbox 360 completely.",Who sells Xbox?,Microsoft
121,Alexander_Graham_Bell,"Bell's father was invited by Sarah Fuller, principal of the Boston School for Deaf Mutes (which continues today as the public Horace Mann School for the Deaf), in Boston, Massachusetts, to introduce the Visible Speech System by providing training for Fuller's instructors, but he declined the post in favor of his son. Traveling to Boston in April 1871, Bell proved successful in training the school's instructors. He was subsequently asked to repeat the program at the American Asylum for Deaf-mutes in Hartford, Connecticut, and the Clarke School for the Deaf in Northampton, Massachusetts.",What kept Bell from training instructors at the Boston School for Deaf Mutes?,his son
122,Classical_music,"The written score, however, does not usually contain explicit instructions as to how to interpret the piece in terms of production or performance, apart from directions for dynamics, tempo and expression (to a certain extent). This is left to the discretion of the performers, who are guided by their personal experience and musical education, their knowledge of the work's idiom, their personal artistic tastes, and the accumulated body of historic performance practices.",What do the performers get to determine?,how to interpret the piece in terms of production or performance
123,Galicia_(Spain),"In northern Galicia, the A Coruña-Ferrol metropolitan area has become increasingly dominant in terms of population. The population of the city of A Coruña in 1900 was 43,971. The population of the rest of the province including the City and Naval Station of nearby Ferrol and Santiago de Compostela was 653,556. A Coruña's growth occurred after the Spanish Civil War at the same speed as other major Galician cities, but it was the arrival of democracy in Spain after the death of Francisco Franco when A Coruña left all the other Galician cities behind.",When did coruna gowth stop in other cities?,after the death of Francisco Franco
124,Tristan_da_Cunha,"During World War II, the islands were used as a top secret Royal Navy weather and radio station codenamed HMS Atlantic Isle, to monitor Nazi U-boats (which were required to maintain radio contact) and shipping movements in the South Atlantic Ocean. The first Administrator, Surgeon Lieutenant Commander E.J.S. Woolley, was appointed by the British government during this time.",West Gondwana (South America and Africa) broke up in the Early Cretaceous to form the __,South Atlantic Ocean
125,Capital_punishment_in_the_United_States,"In the 2010s, American jurisdictions have experienced a shortage of lethal injection drugs, due to anti-death penalty advocacy and low production volume. Hospira, the only U.S. manufacturer of sodium thiopental, stopped making the drug in 2011. The European Union has outlawed the export of any product that could be used in an execution; this has prevented executioners from using EU-manufactured anesthetics like propofol which are needed for general medical purposes. Another alternative, pentobarbital, is also only manufactured in the European Union, which has caused the Danish producer to restrict distribution to U.S. government customers.",Why can't the United States use pentobarbital manufactured in the United States to execute prisoners?,"pentobarbital, is also only manufactured in the European Union"
126,Crimean_War,"The Russians sent a fleet to Sinop in northern Anatolia. In the Battle of Sinop on 30 November 1853 they destroyed a patrol squadron of Ottoman frigates and corvettes while they were anchored in port. Public opinion in the UK and France was outraged and demanded war. Sinop provided the United Kingdom and France with the casus belli (""cause for war"") for declaring war against Russia. On 28 March 1854, after Russia ignored an Anglo-French ultimatum to withdraw from the Danubian Principalities, the UK and France formally declared war.",What did Europe want?,Public opinion in the UK and France was outraged and demanded war
127,Institute_of_technology,"The only technical university in Mauritius is the University of Technology, Mauritius with its main campus situated in La Tour Koenig, Pointe aux Sables. It has a specialized mission with a technology focus. It applies traditional and beyond traditional approaches to teaching, training, research and consultancy. The university has been founded with the aim to play a key role in the economic and social development of Mauritius through the development of programmes of direct relevance to the country’s needs, for example in areas like technology, sustainable development science, and public sector policy and management.",What is the university tasked with?,to play a key role in the economic and social development of Mauritius
128,Estonia,"Perhaps the most famous raid by Oeselian pirates occurred in 1187, with the attack on the Swedish town of Sigtuna by Finnic raiders from Couronia and Oesel. Among the casualties of this raid was the Swedish archbishop Johannes. The city remained occupied for some time, contributing to its decline as a center of commerce in the 13th century and the rise of Uppsala, Visby, Kalmar and Stockholm. The Livonian Chronicle describes the Oeselians as using two kinds of ships, the piratica and the liburna. The former was a warship, the latter mainly a merchant ship. A piratica could carry approximately 30 men and had a high prow shaped like a dragon or a snakehead and a rectangular sail. Viking-age treasures from Estonia mostly contain silver coins and bars. Saaremaa has the richest finds of Viking treasures after Gotland in Sweden. This strongly suggests that Estonia was an important transit country during the Viking era.",What was a piratica?,a warship
129,Montana,"Montana is home to the Rocky Mountain Elk Foundation and has a historic big game hunting tradition. There are fall bow and general hunting seasons for elk, pronghorn antelope, whitetail deer and mule deer. A random draw grants a limited number of permits for moose, mountain goats and bighorn sheep. There is a spring hunting season for black bear and in most years, limited hunting of bison that leave Yellowstone National Park is allowed. Current law allows both hunting and trapping of a specific number of wolves and mountain lions. Trapping of assorted fur bearing animals is allowed in certain seasons and many opportunities exist for migratory waterfowl and upland bird hunting.",What time of year is best to find the largest variety of animals?,fall
130,Frédéric_Chopin,"Chopin's life and his relations with George Sand have been fictionalized in numerous films. The 1945 biographical film A Song to Remember earned Cornel Wilde an Academy Award nomination as Best Actor for his portrayal of the composer. Other film treatments have included: La valse de l'adieu (France, 1928) by Henry Roussel, with Pierre Blanchar as Chopin; Impromptu (1991), starring Hugh Grant as Chopin; La note bleue (1991); and Chopin: Desire for Love (2002).",What was La note bleue about?,Chopin
131,Party_leaders_of_the_United_States_House_of_Representatives,"Devise Minority Party Strategies. The minority leader, in consultation with other party colleagues, has a range of strategic options that he or she can employ to advance minority party objectives. The options selected depend on a wide range of circumstances, such as the visibility or significance of the issue and the degree of cohesion within the majority party. For instance, a majority party riven by internal dissension, as occurred during the early 1900s when Progressive and ""regular"" Republicans were at loggerheads, may provide the minority leader with greater opportunities to achieve his or her priorities than if the majority party exhibited high degrees of party cohesion. Among the variable strategies available to the minority party, which can vary from bill to bill and be used in combination or at different stages of the lawmaking process, are the following:",What is one thing the minority leader can do to advance minority causes and issues.,Devise Minority Party Strategies
132,Houston,"By 1860, Houston had emerged as a commercial and railroad hub for the export of cotton. Railroad spurs from the Texas inland converged in Houston, where they met rail lines to the ports of Galveston and Beaumont. During the American Civil War, Houston served as a headquarters for General John Bankhead Magruder, who used the city as an organization point for the Battle of Galveston. After the Civil War, Houston businessmen initiated efforts to widen the city's extensive system of bayous so the city could accept more commerce between downtown and the nearby port of Galveston. By 1890, Houston was the railroad center of Texas.",How did the railroad center of Texas get its start?,export of cotton
133,British_Isles,"The demographics of the British Isles today are characterised by a generally high density of population in England, which accounts for almost 80% of the total population of the islands. In elsewhere on Great Britain and on Ireland, high density of population is limited to areas around, or close to, a few large cities. The largest urban area by far is the Greater London Urban Area with 9 million inhabitants. Other major populations centres include Greater Manchester Urban Area (2.4 million), West Midlands conurbation (2.4 million), West Yorkshire Urban Area (1.6 million) in England, Greater Glasgow (1.2 million) in Scotland and Greater Dublin Area (1.1 million) in Ireland.[citation needed]",Coventry is separated from the __ by a stretch of green belt land roughly 15 miles across.,West Midlands conurbation
134,Gamal_Abdel_Nasser,"On 26 July 1956, Nasser gave a speech in Alexandria announcing the nationalization of the Suez Canal Company as a means to fund the Aswan Dam project in light of the British–American withdrawal. In the speech, he denounced British imperialism in Egypt and British control over the canal company's profits, and upheld that the Egyptian people had a right to sovereignty over the waterway, especially since ""120,000 Egyptians had died (sic)"" building it. The motion was technically in breach of the international agreement he had signed with the UK on 19 October 1954, although he ensured that all existing stockholders would be paid off.",What did Nasser's speech in Alexandria violate?,the international agreement he had signed with the UK on 19 October 1954
135,Tajikistan,"Drug trafficking is the major illegal source of income in Tajikistan as it is an important transit country for Afghan narcotics bound for Russian and, to a lesser extent, Western European markets; some opium poppy is also raised locally for the domestic market. However, with the increasing assistance from international organizations, such as UNODC, and cooperation with the US, Russian, EU and Afghan authorities a level of progress on the fight against illegal drug-trafficking is being achieved. Tajikistan holds third place in the world for heroin and raw opium confiscations (1216.3 kg of heroin and 267.8 kg of raw opium in the first half of 2006). Drug money corrupts the country's government; according to some experts the well-known personalities that fought on both sides of the civil war and have held the positions in the government after the armistice was signed are now involved in the drug trade. UNODC is working with Tajikistan to strengthen border crossings, provide training, and set up joint interdiction teams. It also helped to establish Tajikistani Drug Control Agency.",What is being done to help combat this issue?,"UNODC is working with Tajikistan to strengthen border crossings, provide training, and set up joint interdiction teams. It also helped to establish Tajikistani Drug Control Agency"
136,Samoa,"The origins of the Samoans are closely studied in modern research about Polynesia in various scientific disciplines such as genetics, linguistics and anthropology. Scientific research is ongoing, although a number of different theories exist; including one proposing that the Samoans originated from Austronesian predecessors during the terminal eastward Lapita expansion period from Southeast Asia and Melanesia between 2,500 and 1,500 BCE. The Samoan origins are currently being reassessed due to new scientific evidence and carbon dating findings from 2003 and onwards.",__ people descended from peoples of East Asia,Lapita
137,Chihuahua_(state),"Villa and Carranza had different political goals causing Villa to become an enemy of Carranza. After Carranza took control in 1914, Villa and other revolutionaries who opposed him met at what was called the Convention of Aguascalientes. The convention deposed Carranza in favor of Eulalio Gutiérrez. In the winter of 1914 Villa's and Zapata's troops entered and occupied Mexico City. Villa was forced from the city in early 1915 and attacked the forces of Gen. Obregón at the Battle of Celaya and was badly defeated in the bloodiest battle of the revolution, with thousands dead. With the defeat of Villa, Carranza seized power. A short time later the United States recognized Carranza as president of Mexico. Even though Villa's forces were badly depleted by his loss at Celaya, he continued his fight against the Carranza government. Finally, in 1920, Obregón—who had defeated him at Celaya—finally reached an agreement with Villa end his rebellion.",When Carranza and Villa become rivals with each other,1914
