,title,context,question,answers
0,Empiricism,"A generation later, the Irish Anglican bishop, George Berkeley (1685–1753), determined that Locke's view immediately opened a door that would lead to eventual atheism. In response to Locke, he put forth in his Treatise Concerning the Principles of Human Knowledge (1710) an important challenge to empiricism in which things only exist either as a result of their being perceived, or by virtue of the fact that they are an entity doing the perceiving. (For Berkeley, God fills in for humans by doing the perceiving whenever humans are not around to do it.) In his text Alciphron, Berkeley maintained that any order humans may see in nature is the language or handwriting of God. Berkeley's approach to empiricism would later come to be called subjective idealism.",what concept is mentioned last?,subjective idealism
1,Windows_8,"Three milestone releases of Windows 8 leaked to the general public. Milestone 1, Build 7850, was leaked on April 12, 2011. It was the first build where the text of a window was written centered instead of aligned to the left. It was also probably the first appearance of the Metro-style font, and its wallpaper had the text shhh... let's not leak our hard work. However, its detailed build number reveals that the build was created on September 22, 2010. The leaked copy edition was Enterprise edition. The OS still reads as ""Windows 7"". Milestone 2, Build 7955, was leaked on April 25, 2011. The traditional Blue Screen of Death (BSoD) was replaced by a new Black screen, although this was later scrapped. This build introduced a new ribbon in Windows Explorer. Build 7959, with minor changes but the first 64-bit version, was leaked on May 1, 2011. The ""Windows 7"" logo was temporarily replaced with text displaying ""Microsoft Confidential"". On June 17, 2011, build 7989 64-bit edition was leaked. It introduced a new boot screen featuring the same fish as the default Windows 7 Beta wallpaper, which was later scrapped, and the circling dots as featured in the final (although the final version comes with smaller circling dots throbber). It also had the text Welcome below them, although this was also scrapped.",Milestone 1 was leaked as?,Enterprise edition
2,Franco-Prussian_War,"The French Marines and naval infantry intended for the invasion of northern Germany were dispatched to reinforce the French Army of Châlons and fell into captivity at Sedan along with Napoleon III. A shortage of officers, following the capture of most of the professional French army at the Siege of Metz and at the Battle of Sedan, led naval officers to be sent from their ships to command hastily assembled reservists of the Garde Mobile. As the autumn storms of the North Sea forced the return of more of the French ships, the blockade of the north German ports diminished and in September 1870 the French navy abandoned the blockade for the winter. The rest of the navy retired to ports along the English Channel and remained in port for the rest of the war.",What happened to the French Marines?,captivity at Sedan
3,Geological_history_of_Earth,"To the north of Africa the Tethys Sea continued to narrow. Broad shallow seas advanced across central North America (the Western Interior Seaway) and Europe, then receded late in the period, leaving thick marine deposits sandwiched between coal beds. At the peak of the Cretaceous transgression, one-third of Earth's present land area was submerged. The Cretaceous is justly famous for its chalk; indeed, more chalk formed in the Cretaceous than in any other period in the Phanerozoic. Mid-ocean ridge activity—or rather, the circulation of seawater through the enlarged ridges—enriched the oceans in calcium; this made the oceans more saturated, as well as increased the bioavailability of the element for calcareous nanoplankton. These widespread carbonates and other sedimentary deposits make the Cretaceous rock record especially fine. Famous formations from North America include the rich marine fossils of Kansas's Smoky Hill Chalk Member and the terrestrial fauna of the late Cretaceous Hell Creek Formation. Other important Cretaceous exposures occur in Europe and China. In the area that is now India, massive lava beds called the Deccan Traps were laid down in the very late Cretaceous and early Paleocene.",What is unique about the Cretaceous?,more chalk formed in the Cretaceous than in any other period in the Phanerozoic
4,Korean_War,"After the formation of the People's Republic of China in 1949, the Chinese government named the Western nations, led by the United States, as the biggest threat to its national security. Basing this judgment on China's century of humiliation beginning in the early 19th century, American support for the Nationalists during the Chinese Civil War, and the ideological struggles between revolutionaries and reactionaries, the Chinese leadership believed that China would become a critical battleground in the United States' crusade against Communism. As a countermeasure and to elevate China's standing among the worldwide Communist movements, the Chinese leadership adopted a foreign policy that actively promoted Communist revolutions throughout territories on China's periphery.",what country is mentioned first?,People's Republic of China
5,Bird,"Incubation, which optimises temperature for chick development, usually begins after the last egg has been laid. In monogamous species incubation duties are often shared, whereas in polygamous species one parent is wholly responsible for incubation. Warmth from parents passes to the eggs through brood patches, areas of bare skin on the abdomen or breast of the incubating birds. Incubation can be an energetically demanding process; adult albatrosses, for instance, lose as much as 83 grams (2.9 oz) of body weight per day of incubation. The warmth for the incubation of the eggs of megapodes comes from the sun, decaying vegetation or volcanic sources. Incubation periods range from 10 days (in woodpeckers, cuckoos and passerine birds) to over 80 days (in albatrosses and kiwis).",What is incubated?,egg
6,Symbiosis,"The biologist Lynn Margulis, famous for her work on endosymbiosis, contends that symbiosis is a major driving force behind evolution. She considers Darwin's notion of evolution, driven by competition, to be incomplete and claims that evolution is strongly based on co-operation, interaction, and mutual dependence among organisms. According to Margulis and Dorion Sagan, ""Life did not take over the globe by combat, but by networking.""",How is Darwin's notion incomplete?,"strongly based on co-operation, interaction, and mutual dependence among organisms"
7,George_VI,"His birthday (14 December 1895) was the 34th anniversary of the death of his great-grandfather, Prince Albert, the Prince Consort. Uncertain of how the Prince Consort's widow, Queen Victoria, would take the news of the birth, the Prince of Wales wrote to the Duke of York that the Queen had been ""rather distressed"". Two days later, he wrote again: ""I really think it would gratify her if you yourself proposed the name Albert to her"". Queen Victoria was mollified by the proposal to name the new baby Albert, and wrote to the Duchess of York: ""I am all impatience to see the new one, born on such a sad day but rather more dear to me, especially as he will be called by that dear name which is a byword for all that is great and good"". Consequently, he was baptised ""Albert Frederick Arthur George"" at St. Mary Magdalene's Church near Sandringham three months later.[a] As a great-grandson of Queen Victoria, he was known formally as His Highness Prince Albert of York from birth. Within the family, he was known informally as ""Bertie"". His maternal grandmother, the Duchess of Teck, did not like the first name the baby had been given, and she wrote prophetically that she hoped the last name ""may supplant the less favoured one"".",who wrote to the duchess of york?,Queen Victoria
8,Middle_Ages,"Monastic reform inspired change in the secular church. The ideals that it was based upon were brought to the papacy by Pope Leo IX (pope 1049–1054), and provided the ideology of the clerical independence that led to the Investiture Controversy in the late 11th century. This involved Pope Gregory VII (pope 1073–85) and Emperor Henry IV, who initially clashed over episcopal appointments, a dispute that turned into a battle over the ideas of investiture, clerical marriage, and simony. The emperor saw the protection of the Church as one of his responsibilities as well as wanting to preserve the right to appoint his own choices as bishops within his lands, but the papacy insisted on the Church's independence from secular lords. These issues remained unresolved after the compromise of 1122 known as the Concordat of Worms. The dispute represents a significant stage in the creation of a papal monarchy separate from and equal to lay authorities. It also had the permanent consequence of empowering German princes at the expense of the German emperors.",Monastic reform changed the church and caused what?,Investiture Controversy
9,Military_history_of_the_United_States,"When revolutionary France declared war on Great Britain in 1793, the United States sought to remain neutral, but the Jay Treaty, which was favorable to Great Britain, angered the French government, which viewed it as a violation of the 1778 Treaty of Alliance. French privateers began to seize U.S. vessels, which led to an undeclared ""Quasi-War"" between the two nations. Fought at sea from 1798 to 1800, the United States won a string of victories in the Caribbean. George Washington was called out of retirement to head a ""provisional army"" in case of invasion by France, but President John Adams managed to negotiate a truce, in which France agreed to terminate the prior alliance and cease its attacks.","Which happened first, France declaring war on Great Britain or the Quasi War?",France declared war on Great Britain
10,Quran,"Sahih al-Bukhari narrates Muhammad describing the revelations as, ""Sometimes it is (revealed) like the ringing of a bell"" and Aisha reported, ""I saw the Prophet being inspired Divinely on a very cold day and noticed the sweat dropping from his forehead (as the Inspiration was over)."" Muhammad's first revelation, according to the Quran, was accompanied with a vision. The agent of revelation is mentioned as the ""one mighty in power"", the one who ""grew clear to view when he was on the uppermost horizon. Then he drew nigh and came down till he was (distant) two bows' length or even nearer."" The Islamic studies scholar Welch states in the Encyclopaedia of Islam that he believes the graphic descriptions of Muhammad's condition at these moments may be regarded as genuine, because he was severely disturbed after these revelations. According to Welch, these seizures would have been seen by those around him as convincing evidence for the superhuman origin of Muhammad's inspirations. However, Muhammad's critics accused him of being a possessed man, a soothsayer or a magician since his experiences were similar to those claimed by such figures well known in ancient Arabia. Welch additionally states that it remains uncertain whether these experiences occurred before or after Muhammad's initial claim of prophethood.",What does Welch point out about the first revelation?,graphic descriptions of Muhammad's condition at these moments may be regarded as genuine
11,Neptune,"Neptune is similar in composition to Uranus, and both have compositions that differ from those of the larger gas giants, Jupiter and Saturn. Like Jupiter and Saturn, Neptune's atmosphere is composed primarily of hydrogen and helium, along with traces of hydrocarbons and possibly nitrogen, but contains a higher proportion of ""ices"" such as water, ammonia, and methane. However, its interior, like that of Uranus, is primarily composed of ices and rock, and hence Uranus and Neptune are normally considered ""ice giants"" to emphasise this distinction. Traces of methane in the outermost regions in part account for the planet's blue appearance.",What is the gas in Uranus different from?,Jupiter and Saturn
12,To_Kill_a_Mockingbird,"The theme of racial injustice appears symbolically in the novel as well. For example, Atticus must shoot a rabid dog, even though it is not his job to do so. Carolyn Jones argues that the dog represents prejudice within the town of Maycomb, and Atticus, who waits on a deserted street to shoot the dog, must fight against the town's racism without help from other white citizens. He is also alone when he faces a group intending to lynch Tom Robinson and once more in the courthouse during Tom's trial. Lee even uses dreamlike imagery from the mad dog incident to describe some of the courtroom scenes. Jones writes, ""[t]he real mad dog in Maycomb is the racism that denies the humanity of Tom Robinson .... When Atticus makes his summation to the jury, he literally bares himself to the jury's and the town's anger.""",What does the shooting of the dog represent?,racial injustice
13,Association_football,"After the World Cup, the most important international football competitions are the continental championships, which are organised by each continental confederation and contested between national teams. These are the European Championship (UEFA), the Copa América (CONMEBOL), African Cup of Nations (CAF), the Asian Cup (AFC), the CONCACAF Gold Cup (CONCACAF) and the OFC Nations Cup (OFC). The FIFA Confederations Cup is contested by the winners of all six continental championships, the current FIFA World Cup champions and the country which is hosting the Confederations Cup. This is generally regarded as a warm-up tournament for the upcoming FIFA World Cup and does not carry the same prestige as the World Cup itself. The most prestigious competitions in club football are the respective continental championships, which are generally contested between national champions, for example the UEFA Champions League in Europe and the Copa Libertadores in South America. The winners of each continental competition contest the FIFA Club World Cup.",What is the shortened form of the African Cup?,CAF
14,Affirmative_action_in_the_United_States,"Ideas for affirmative action came as early as the Reconstruction Era (1865-1877) in which a former slave population lacked the skills and resources for sustainable living. In 1865, General William Tecumseh Sherman proposed to divide the land and goods from Georgia and grant it to families of color which became the ""Forty acres and a mule"" policy. The proposal was never widely adopted due to strong political opposition. Nearly a century later (1950s-1960s), policies to assist classes of individuals reemerged during the Civil Rights Movement. The civil rights guarantees came through the interpretation of the Equal Protection Clause of the 14th Amendment. The decisions came to be known as affirmative action in which mandatory, as well as voluntary programs, affirmed the civil rights of people of color. Furthermore, these affirmative action programs protected people of color from the present effects stemming from past discrimination. In 1961, President John F. Kennedy became the first to utilize the term ""affirmative action"" in Executive Order 10925 to ensure that government contractors ""take affirmative action to ensure that applicants are employed, and employees are treated during employment, without regard to their race, creed, color, or national origin."" This executive order realized the government's intent to create equal opportunities for all qualified people. This executive order was eventually amended and superseded by Lyndon B. Johnson's Executive Order 11246 which prevented discrimination based on race, color, religion, and national origin by organizations which received federal contracts and subcontracts. In 1967, the order was amended to include sex as well. The Reagan administration was opposed to the affirmative action requirements of Executive Order 11246, but these contemplated changes[which?] faced bi-partisan opposition in Congress.",what order was amended and superseded by Executive order 11246?,realized
15,Modern_history,"The Russian Revolution is the series of revolutions in Russia in 1917, which destroyed the Tsarist autocracy and led to the creation of the Soviet Union. Following the abdication of Nicholas II of Russia, the Russian Provisional Government was established. In October 1917, a red faction revolution occurred in which the Red Guard, armed groups of workers and deserting soldiers directed by the Bolshevik Party, seized control of Saint Petersburg (then known as Petrograd) and began an immediate armed takeover of cities and villages throughout the former Russian Empire.",what is the first ethnicity mentioned?,Russian
16,Phonology,"In a course at the LSA summer institute in 1991, Alan Prince and Paul Smolensky developed optimality theory—an overall architecture for phonology according to which languages choose a pronunciation of a word that best satisfies a list of constraints ordered by importance; a lower-ranked constraint can be violated when the violation is necessary in order to obey a higher-ranked constraint. The approach was soon extended to morphology by John McCarthy and Alan Prince, and has become a dominant trend in phonology. The appeal to phonetic grounding of constraints and representational elements (e.g. features) in various approaches has been criticized by proponents of 'substance-free phonology', especially Mark Hale and Charles Reiss.",Prince helped develop phonology with?,Paul Smolensky
17,Protestantism,"Politically, Calvin favoured a mixture of aristocracy and democracy. He appreciated the advantages of democracy: ""It is an invaluable gift, if God allows a people to freely elect its own authorities and overlords."" Calvin also thought that earthly rulers lose their divine right and must be put down when they rise up against God. To further protect the rights of ordinary people, Calvin suggested separating political powers in a system of checks and balances (separation of powers). Thus he and his followers resisted political absolutism and paved the way for the rise of modern democracy. Besides England, the Netherlands were, under Calvinist leadership, the freest country in Europe in the seventeenth and eighteenth centuries. It granted asylum to philosophers like Baruch Spinoza and Pierre Bayle. Hugo Grotius was able to teach his natural-law theory and a relatively liberal interpretation of the Bible.",Calvins view of democracy?,"It is an invaluable gift, if God allows a people to freely elect its own authorities and overlords"
18,Jehovah%27s_Witnesses,"Jehovah's Witnesses believe that the Bible condemns the mixing of religions, on the basis that there can only be one truth from God, and therefore reject interfaith and ecumenical movements. They believe that only their religion represents true Christianity, and that other religions fail to meet all the requirements set by God and will soon be destroyed. Jehovah's Witnesses are taught that it is vital to remain ""separate from the world."" The Witnesses' literature defines the ""world"" as ""the mass of mankind apart from Jehovah's approved servants"" and teach that it is morally contaminated and ruled by Satan. Witnesses are taught that association with ""worldly"" people presents a ""danger"" to their faith, and are instructed to minimize social contact with non-members to better maintain their own standards of morality.",Jehovah's Witness believes what about religion?,there can only be one truth from God
19,Treaty,"In the United States, the term ""treaty"" has a different, more restricted legal sense than exists in international law. United States law distinguishes what it calls treaties from executive agreement, congressional-executive agreements, and sole executive agreements. All four classes are equally treaties under international law; they are distinct only from the perspective of internal American law. The distinctions are primarily concerning their method of approval. Whereas treaties require advice and consent by two-thirds of the Senators present, sole executive agreements may be executed by the President acting alone. Some treaties grant the President the authority to fill in the gaps with executive agreements, rather than additional treaties or protocols. And finally, congressional-executive agreements require majority approval by both the House and the Senate, either before or after the treaty is signed by the President.",What kind of treaties involved the President's approval?,"executive agreement, congressional-executive agreements, and sole executive agreements"
20,Edmund_Burke,"In November 1790, François-Louis-Thibault de Menonville, a member of the National Assembly of France, wrote to Burke, praising Reflections and requesting more ""very refreshing mental food"" that he could publish. This Burke did in April 1791 when he published A Letter to a Member of the National Assembly. Burke called for external forces to reverse the revolution and included an attack on the late French philosopher Jean-Jacques Rousseau, as being the subject of a personality cult that had developed in revolutionary France. Although Burke conceded that Rousseau sometimes showed ""a considerable insight into human nature"" he mostly was critical. Although he did not meet Rousseau on his visit to Britain in 1766–7 Burke was a friend of David Hume, with whom Rousseau had stayed. Burke said Rousseau ""entertained no principle either to influence of his heart, or to guide his understanding—but vanity""—which he ""was possessed to a degree little short of madness"". He also cited Rousseau's Confessions as evidence that Rousseau had a life of ""obscure and vulgar vices"" that was not ""chequered, or spotted here and there, with virtues, or even distinguished by a single good action"". Burke contrasted Rousseau's theory of universal benevolence and his having sent his children to a foundling hospital: ""a lover of his kind, but a hater of his kindred"".",What did Thibault say about Reflections?,very refreshing mental food
21,Brain,"The SCN projects to a set of areas in the hypothalamus, brainstem, and midbrain that are involved in implementing sleep-wake cycles. An important component of the system is the reticular formation, a group of neuron-clusters scattered diffusely through the core of the lower brain. Reticular neurons send signals to the thalamus, which in turn sends activity-level-controlling signals to every part of the cortex. Damage to the reticular formation can produce a permanent state of coma.",What is another name for the suprachiasmatic nucleus?,SCN
22,Paris,"Paris is located in northern central France. By road it is 450 kilometres (280 mi) south-east of London, 287 kilometres (178 mi) south of Calais, 305 kilometres (190 mi) south-west of Brussels, 774 kilometres (481 mi) north of Marseille, 385 kilometres (239 mi) north-east of Nantes, and 135 kilometres (84 mi) south-east of Rouen. Paris is located in the north-bending arc of the river Seine and includes two islands, the Île Saint-Louis and the larger Île de la Cité, which form the oldest part of the city. The river's mouth on the English Channel (La Manche) is about 233 mi (375 km) downstream of the city, established around 7600 BC. The city is spread widely on both banks of the river. Overall, the city is relatively flat, and the lowest point is 35 m (115 ft) above sea level. Paris has several prominent hills, the highest of which is Montmartre at 130 m (427 ft). Montmartre gained its name from the martyrdom of Saint Denis, first bishop of Paris, atop the Mons Martyrum, ""Martyr's mound"", in 250.","What is farthest east, Paris, Brussels or Rouen?",Brussels
23,Antibiotics,"The emergence of antibiotic resistance has prompted restrictions on their use in the UK in 1970 (Swann report 1969), and the EU has banned the use of antibiotics as growth-promotional agents since 2003. Moreover, several organizations (e.g., The American Society for Microbiology (ASM), American Public Health Association (APHA) and the American Medical Association (AMA)) have called for restrictions on antibiotic use in food animal production and an end to all nontherapeutic uses.[citation needed] However, commonly there are delays in regulatory and legislative actions to limit the use of antibiotics, attributable partly to resistance against such regulation by industries using or selling antibiotics, and to the time required for research to test causal links between their use and resistance to them. Two federal bills (S.742 and H.R. 2562) aimed at phasing out nontherapeutic use of antibiotics in US food animals were proposed, but have not passed. These bills were endorsed by public health and medical organizations, including the American Holistic Nurses' Association, the American Medical Association, and the American Public Health Association (APHA).",What was the first restriction of antibiotics for?,emergence of antibiotic resistance
