,title,context,question,answers
310,YouTube,"On November 6, 2013, Google implemented a new comment system that requires all YouTube users to use a Google+ account in order to comment on videos and making the comment system Google+ oriented. The changes are in large part an attempt to address the frequent criticisms of the quality and tone of YouTube comments. They give creators more power to moderate and block comments, and add new sorting mechanisms to ensure that better, more relevant discussions appear at the top. The new system restored the ability to include URLs in comments, which had previously been removed due to problems with abuse. In response, YouTube co-founder Jawed Karim posted the question ""why the fuck do I need a google+ account to comment on a video?"" on his YouTube channel to express his negative opinion of the change. The official YouTube announcement received 20,097 ""thumbs down"" votes and generated more than 32,000 comments in two days. Writing in the Newsday blog Silicon Island, Chase Melvin noted that ""Google+ is nowhere near as popular a social media network as Facebook, but it's essentially being forced upon millions of YouTube users who don't want to lose their ability to comment on videos"" and ""Discussion forums across the Internet are already bursting with outcry against the new comment system"". In the same article Melvin goes on to say:",Given to the negative feedback what did Google put in place for YouTube users wishing to make comments?,new comment system
311,Napoleon,"By 17 May, the main Austrian army under Charles had arrived on the Marchfeld. Charles kept the bulk of his troops several miles away from the river bank in hopes of concentrating them at the point where Napoleon decided to cross. On 21 May, the French made their first major effort to cross the Danube, precipitating the Battle of Aspern-Essling. The Austrians enjoyed a comfortable numerical superiority over the French throughout the battle; on the first day, Charles disposed of 110,000 soldiers against only 31,000 commanded by Napoleon. By the second day, reinforcements had boosted French numbers up to 70,000. The battle was characterized by a vicious back-and-forth struggle for the two villages of Aspern and Essling, the focal points of the French bridgehead. By the end of the fighting, the French had lost Aspern but still controlled Essling. A sustained Austrian artillery bombardment eventually convinced Napoleon to withdraw his forces back onto Lobau Island. Both sides inflicted about 23,000 casualties on each other. It was the first defeat Napoleon suffered in a major set-piece battle, and it caused excitement throughout many parts of Europe because it proved that he could be beaten on the battlefield.",Which army defeated Napoleon's army is this battle?,Austrian army
312,Cubism,"The original Cubist architecture is very rare. There is only one country in the world where Cubism was really applied to architecture – namely Bohemia (today Czech Republic) and especially its capital, Prague. Czech architects were the first and only ones in the world to ever design original Cubist buildings. Cubist architecture flourished for the most part between 1910–1914, but the Cubist or Cubism-influenced buildings were also built after the World War I. After the war, the architectural style called Rondo-Cubism was developed in Prague fusing the Cubist architecture with round shapes.",Name a country where Cubism architecture is used.,Bohemia
313,Political_philosophy,"Another debate developed around the (distinct) criticisms of liberal political theory made by Michael Walzer, Michael Sandel and Charles Taylor. The liberal-communitarian debate is often considered valuable for generating a new set of philosophical problems, rather than a profound and illuminating clash of perspective.These and other communitarians (such as Alasdair MacIntyre and Daniel A. Bell) argue that, contra liberalism, communities are prior to individuals and therefore should be the center of political focus. Communitarians tend to support greater local control as well as economic and social policies which encourage the growth of social capital.",Who in the article shared the same first name?,"Michael Walzer, Michael Sandel"
314,Comcast,"On February 12, 2014, the Los Angeles Times reported that Comcast sought to acquire Time Warner Cable in a deal valued at $45.2 billion. On February 13, it was reported that Time Warner Cable agreed to the acquisition. This was to add several metropolitan areas to the Comcast portfolio, such as New York City, Los Angeles, Dallas-Fort Worth, Cleveland, Columbus, Cincinnati, Charlotte, San Diego, and San Antonio. Time Warner Cable and Comcast aimed to merge into one company by the end of 2014 and both have praised the deal, emphasizing the increased capabilities of a combined telecommunications network, and to ""create operating efficiencies and economies of scale"".",How many cities in Comcast's portfolio at the time began with the letter C?,"Cleveland, Columbus, Cincinnati, Charlotte"
315,Bacteria,"Once regarded as plants constituting the class Schizomycetes, bacteria are now classified as prokaryotes. Unlike cells of animals and other eukaryotes, bacterial cells do not contain a nucleus and rarely harbour membrane-bound organelles. Although the term bacteria traditionally included all prokaryotes, the scientific classification changed after the discovery in the 1990s that prokaryotes consist of two very different groups of organisms that evolved from an ancient common ancestor. These evolutionary domains are called Bacteria and Archaea.",What is an uncommon trait in the cells of bacteria that some may not contain?,prokaryotes
316,Copper,"The major applications of copper are in electrical wires (60%), roofing and plumbing (20%) and industrial machinery (15%). Copper is mostly used as a pure metal, but when a higher hardness is required it is combined with other elements to make an alloy (5% of total use) such as brass and bronze. A small part of copper supply is used in production of compounds for nutritional supplements and fungicides in agriculture. Machining of copper is possible, although it is usually necessary to use an alloy for intricate parts to get good machinability characteristics.","If it is not used as an allow, what is the form in which copper is used?",pure metal
317,Ministry_of_Defence_(United_Kingdom),"The headquarters of the MoD are in Whitehall and are now known as Main Building. This structure is neoclassical in style and was originally built between 1938 and 1959 to designs by Vincent Harris to house the Air Ministry and the Board of Trade. The northern entrance in Horse Guards Avenue is flanked by two monumental statues, Earth and Water, by Charles Wheeler. Opposite stands the Gurkha Monument, sculpted by Philip Jackson and unveiled in 1997 by Queen Elizabeth II. Within it is the Victoria Cross and George Cross Memorial, and nearby are memorials to the Fleet Air Arm and RAF (to its east, facing the riverside). A major refurbishment of the building was completed under a PFI contract by Skanska in 2004.","Who, between Victor Harris and Charles Wheeler, did NOT design the two monumental statues?",Vincent Harris
318,Dialect,"The most common, and most purely linguistic, criterion is that of mutual intelligibility: two varieties are said to be dialects of the same language if being a speaker of one variety confers sufficient knowledge to understand and be understood by a speaker of the other; otherwise, they are said to be different languages. However, this definition becomes problematic in the case of dialect continua, in which it may be the case that dialect B is mutually intelligible with both dialect A and dialect C but dialects A and C are not mutually intelligible with each other. In this case the criterion of mutual intelligibility makes it impossible to decide whether A and C are dialects of the same language or not. Cases may also arise in which a speaker of dialect X can understand a speaker of dialect Y, but not vice versa; the mutual intelligibility criterion flounders here as well.",When does the concept of mutual intelligibility not hold true?,"a speaker of dialect X can understand a speaker of dialect Y, but not vice versa"
319,Department_store,"After World War II Hudson's realized that the limited parking space at its downtown skyscraper would increasingly be a problem for its customers. The solution in 1954 was to open the Northland Center in nearby Southfield, just beyond the city limits. It was the largest suburban shopping center in the world, and quickly became the main shopping destination for northern and western Detroit, and for much of the suburbs. By 1961 the downtown skyscraper accounted for only half of Hudson's sales; it closed in 1986. The Northland Center Hudson's, rebranded Macy's in 2006 following acquisition by Federated Department Stores, was closed along with the remaining stores in the center in March 2015 due to the mall's high storefront vacancy, decaying infrastructure, and financial mismanagement.","Before 1962, how much business did Hudson's skyscraper do?",half of Hudson's sales
320,Labour_Party_(UK),"The 1923 general election was fought on the Conservatives' protectionist proposals but, although they got the most votes and remained the largest party, they lost their majority in parliament, necessitating the formation of a government supporting free trade. Thus, with the acquiescence of Asquith's Liberals, Ramsay MacDonald became the first ever Labour Prime Minister in January 1924, forming the first Labour government, despite Labour only having 191 MPs (less than a third of the House of Commons).",What appear after the election was a new labour prime minister in function?,1924
321,Slavs,"Slavic standard languages which are official in at least one country: Belarusian, Bosnian, Bulgarian, Croatian, Czech, Macedonian, Montenegrin, Polish, Russian, Serbian, Slovak, Slovene, and Ukrainian. The alphabet depends on what religion is usual for the respective Slavic ethnic groups. The Orthodox use the Cyrillic alphabet and the Roman Catholics use Latin alphabet, the Bosniaks who are Muslims also use the Latin. Few Greek Roman and Roman Catholics use the Cyrillic alphabet however. The Serbian language and Montenegrin language uses both Cyrillic and Latin alphabets. There is also a Latin script to write in Belarusian, called the Lacinka alphabet.",What's the defining factor for which alphabet a Slavic community uses?,religion
322,Crucifixion_of_Jesus,"According to the canonical gospels, Jesus, whom Christians believe to be the Son of God as well as the Messiah (Christ), was arrested, tried, and sentenced by Pontius Pilate to be scourged, and finally crucified by the Romans. Jesus was stripped of his clothing and offered wine mixed with gall to drink, before being crucified. He was then hung for six hours (according to Mark's Gospel) between two convicted thieves. During this time, the soldiers affixed a sign to the top of the cross stating ""Jesus of Nazareth, King of the Jews"" in three languages. They then divided his garments among them, but cast lots for his seamless robe. After Jesus' death they pierced his side with a spear to be certain that he had died. The Bible records seven statements that Jesus made while he was on the cross, as well as several supernatural events that occurred.",Where was Jesus placed in terms of the three crosses?,between two convicted thieves
323,Eritrea,"In an attempt at reform, Eritrean government officials and NGO representatives have participated in numerous public meetings and dialogues. In these sessions they have answered questions as fundamental as, ""What are human rights?"", ""Who determines what are human rights?"", and ""What should take precedence, human or communal rights?"" In 2007, the Eritrean government also banned female genital mutilation. In Regional Assemblies and religious circles, Eritreans themselves speak out continuously against the use of female circumcision. They cite health concerns and individual freedom as being of primary concern when they say this. Furthermore, they implore rural peoples to cast away this ancient cultural practice. Additionally, a new movement called Citizens for Democratic Rights in Eritrea aimed at bringing about dialogue between the government and opposition was formed in early 2009. The group consists of ordinary citizens and some people close to the government.",Why is female genital mutilation practiced?,ancient cultural practice
324,Hindu_philosophy,"Early history of Shaivism is difficult to determine. However, the Śvetāśvatara Upanishad (400 – 200 BCE) is considered to be the earliest textual exposition of a systematic philosophy of Shaivism. Shaivism is represented by various philosophical schools, including non-dualist (abheda), dualist (bheda), and non-dualist-with-dualist (bhedābheda) perspectives. Vidyaranya in his works mentions three major schools of Shaiva thought— Pashupata Shaivism, Shaiva Siddhanta and Pratyabhijña (Kashmir Shaivism).",What can you break down the schools of thought surrounding this into?,"non-dualist (abheda), dualist (bheda), and non-dualist-with-dualist (bhedābheda) perspectives"
325,Energy,"Energy transformations in the universe over time are characterized by various kinds of potential energy that has been available since the Big Bang later being ""released"" (transformed to more active types of energy such as kinetic or radiant energy) when a triggering mechanism is available. Familiar examples of such processes include nuclear decay, in which energy is released that was originally ""stored"" in heavy isotopes (such as uranium and thorium), by nucleosynthesis, a process ultimately using the gravitational potential energy released from the gravitational collapse of supernovae, to store energy in the creation of these heavy elements before they were incorporated into the solar system and the Earth. This energy is triggered and released in nuclear fission bombs or in civil nuclear power generation. Similarly, in the case of a chemical explosion, chemical potential energy is transformed to kinetic energy and thermal energy in a very short time. Yet another example is that of a pendulum. At its highest points the kinetic energy is zero and the gravitational potential energy is at maximum. At its lowest point the kinetic energy is at maximum and is equal to the decrease of potential energy. If one (unrealistically) assumes that there is no friction or other losses, the conversion of energy between these processes would be perfect, and the pendulum would continue swinging forever.",Familiar examples of such processes include what?,Familiar examples of such processes include
326,High-definition_television,"The Nippon Hōsō Kyōkai (NHK, the Japan Broadcasting Corporation) began conducting research to ""unlock the fundamental mechanism of video and sound interactions with the five human senses"" in 1964, after the Tokyo Olympics. NHK set out to create an HDTV system that ended up scoring much higher in subjective tests than NTSC's previously dubbed ""HDTV"". This new system, NHK Color, created in 1972, included 1125 lines, a 5:3 aspect ratio and 60 Hz refresh rate. The Society of Motion Picture and Television Engineers (SMPTE), headed by Charles Ginsburg, became the testing and study authority for HDTV technology in the international theater. SMPTE would test HDTV systems from different companies from every conceivable perspective, but the problem of combining the different formats plagued the technology for many years.",What did better than in other tests?,NHK Color
327,Daylight_saving_time,"Beginning and ending dates are roughly the reverse in the southern hemisphere. For example, mainland Chile observed DST from the second Saturday in October to the second Saturday in March, with transitions at 24:00 local time. The time difference between the United Kingdom and mainland Chile could therefore be five hours during the Northern summer, three hours during the Southern summer and four hours a few weeks per year because of mismatch of changing dates.",what discern chile?,The time difference
328,Textual_criticism,"In the English language, the works of Shakespeare have been a particularly fertile ground for textual criticism—both because the texts, as transmitted, contain a considerable amount of variation, and because the effort and expense of producing superior editions of his works have always been widely viewed as worthwhile. The principles of textual criticism, although originally developed and refined for works of antiquity, the Bible, and Shakespeare, have been applied to many works, extending backwards from the present to the earliest known written documents, in Mesopotamia and Egypt—a period of about five millennia. However, the application of textual criticism to non-religious works does not antedate the invention of printing. While Christianity has been relatively receptive to textual criticism, application of it to the Jewish (Masoretic) Torah and the Qur'an is, to the devout, taboo.[citation needed]","Which religious text, other than the Torah and Qur'an, is mentioned in the article?",the Bible
329,Federal_Bureau_of_Investigation,"During the period from 1993 to 2011, FBI agents fired their weapons on 289 occasions; FBI internal reviews found the shots justified in all but 5 cases, in none of the 5 cases were people wounded. Samuel Walker, a professor of criminal justice at the University of Nebraska Omaha said the number of shots found to be unjustified was ""suspiciously low."" In the same time period, the FBI wounded 150 people, 70 of whom died; the FBI found all 150 shootings to be justified. Likewise, during the period from 2011 to the present, all shootings by FBI agents have been found to be justified by internal investigation. In a 2002 case in Maryland, an innocent man was shot, and later paid $1.3 million by the FBI after agents mistook him for a bank robber; the internal investigation found that the shooting was justified, based on the man's actions.",What did the FBI shoot almost 300 times?,their weapons
330,Russian_Soviet_Federative_Socialist_Republic,"At the end of World War II Soviet troops occupied southern Sakhalin Island and the Kuril Islands, making them part of the RSFSR. The status of the southernmost Kurils remains in dispute with Japan.",What kind of territories were taken over by the Soviets?,Islands
331,Old_English,"Due to the centralisation of power and the Viking invasions, there is relatively little written record of the non-Wessex dialects after Alfred's unification. Some Mercian texts continued to be written, however, and the influence of Mercian is apparent in some of the translations produced under Alfred's programme, many of which were produced by Mercian scholars. Other dialects certainly continued to be spoken, as is evidenced by the continued variation between their successors in Middle and Modern English. In fact, what would become the standard forms of Middle English and of Modern English are descended from Mercian rather than West Saxon, while Scots developed from the Northumbrian dialect. It was once claimed that, owing to its position at the heart of the Kingdom of Wessex, the relics of Anglo-Saxon accent, idiom and vocabulary were best preserved in the dialect of Somerset.",Who was responsible for the language shift?,Viking
332,United_States_Army,"Training in the U.S. Army is generally divided into two categories – individual and collective. Basic training consists of 10 weeks for most recruits followed by Advanced Individualized Training (AIT) where they receive training for their military occupational specialties (MOS). Some individuals MOSs range anywhere from 14–20 weeks of One Station Unit Training (OSUT), which combines Basic Training and AIT. The length of AIT school varies by the MOS The length of time spent in AIT depends on the MOS of the soldier, and some highly technical MOS training may require many months (e.g., foreign language translators). Depending on the needs of the army, Basic Combat Training for combat arms soldiers is conducted at a number of locations, but two of the longest-running are the Armor School and the Infantry School, both at Fort Benning, Georgia.",What is the location of BCT dependent upon?,the needs of the army
333,Pitch_(music),"The just-noticeable difference (jnd) (the threshold at which a change is perceived) depends on the tone's frequency content. Below 500 Hz, the jnd is about 3 Hz for sine waves, and 1 Hz for complex tones; above 1000 Hz, the jnd for sine waves is about 0.6% (about 10 cents). The jnd is typically tested by playing two tones in quick succession with the listener asked if there was a difference in their pitches. The jnd becomes smaller if the two tones are played simultaneously as the listener is then able to discern beat frequencies. The total number of perceptible pitch steps in the range of human hearing is about 1,400; the total number of notes in the equal-tempered scale, from 16 to 16,000 Hz, is 120.",How many tones are required to determine if change is percieved,two
334,Estonian_language,"Estonian has been influenced by Swedish, German (initially Middle Low German, which was the lingua franca of the Hanseatic League and spoken natively in the territories of what is today known as Estonia by a sizeable burgher community of Baltic Germans, later Estonian was also influenced by standard German), and Russian, though it is not related to them genetically.",What has shaped Estonian?,"Swedish, German (initially Middle Low German, which was the lingua franca of the Hanseatic League and spoken natively in the territories of what is today known as Estonia by a sizeable burgher community of Baltic Germans, later Estonian was also influenced by standard German), and Russian"
335,Multiracial_American,"Multiracial people who wanted to acknowledge their full heritage won a victory of sorts in 1997, when the Office of Management and Budget (OMB) changed the federal regulation of racial categories to permit multiple responses. This resulted in a change to the 2000 United States Census, which allowed participants to select more than one of the six available categories, which were, in brief: ""White,"" ""Black or African American,"" ""Asian,"" ""American Indian or Alaskan Native,"" ""Native Hawaiian or other Pacific Islander,"" and ""Other."" Further details are given in the article: Race (U.S. census). The OMB made its directive mandatory for all government forms by 2003.",What did allowing multiple responses do?,resulted in a change to the 2000 United States Census
336,Canadian_Armed_Forces,"The Canadian Armed Forces have a total reserve force of approximately 50,000 primary and supplementary that can be called upon in times of national emergency or threat. For the components and sub-components of the Canadian Armed Forces Reserve Force, the order of precedence follows:",What are the total ranks that the Canadian Armed Forces reserve force employs?,"50,000"
337,Predation,"The elimination of wolves from Yellowstone National Park had profound impacts on the trophic pyramid. Without predation, herbivores began to over-graze many woody browse species, affecting the area's plant populations. In addition, wolves often kept animals from grazing in riparian areas, which protected beavers from having their food sources encroached upon. The removal of wolves had a direct effect on beaver populations, as their habitat became territory for grazing. Furthermore, predation keeps hydrological features such as creeks and streams in normal working order. Increased browsing on willows and conifers along Blacktail Creek due to a lack of predation caused channel incision because they helped slow the water down and hold the soil in place.",What was the consequence of the wolf population dropping?,profound impacts on the trophic pyramid
338,Spanish_language_in_the_United_States,"Until the 20th century, there was no clear record of the number of Venezuelans who emigrated to the United States. Between the 18th and early 19th centuries, there were many European immigrants who went to Venezuela, only to later migrate to the United States along with their children and grandchildren who born and/or grew up in Venezuela speaking Spanish. From 1910 to 1930, it is estimated that over 4,000 South Americans each year emigrated to the United States; however, there are few specific figures indicating these statistics. Many Venezuelans settled in the United States with hopes of receiving a better education, only to remain in there following graduation. They are frequently joined by relatives. However, since the early 1980s, the reasons for Venezuelan emigration have changed to include hopes of earning a higher salary and due to the economic fluctuations in Venezuela which also promoted an important migration of Venezuelan professionals to the US.",What group of Venezuelans migrated to the US specifically to make more money?,Venezuelan professionals
